{"schema_version":"1","event_uid":"evt-003","job_id":"job-abc123","step_id":"step-fetch","span_id":"span-001","parent_span_id":"span-000","agent_id":"my-agent","tenant_id":"tenant-acme","occurred_at":"2026-09-21T12:35:02Z","type":"step_finished","payload":{"duration_ms":5000},"sdk_name":"aetheris-durability-go","sdk_version":"0.1.0"}
